{
  "project_code": "WX-YGJ",
  "work_item_id": "",
  "generated_at": "",
  "generated_from": [],
  "requirement_summary": {
    "title": "WX-YGJ",
    "summary_text": "",
    "primary_pages": [],
    "primary_user_surfaces": [],
    "source_notes": []
  },
  "explicit_rules": [],
  "implicit_rules": [],
  "field_constraints": [],
  "data_source_rules": [],
  "business_risks": [],
  "edge_cases": [],
  "ambiguities": [],
  "recommended_test_dimensions": [],
  "coverage_candidates": []
}
